id,question,answer,subject,difficulty
1,"What is 1 + 1?","2","math","easy"
2,"Who wrote '1984'?","George Orwell","history","medium"
3,"What is the chemical formula for water?","H2O","science","easy"
4,"In which year did the Titanic sink?","1912","history","medium"
5,"What is 3 * 4?","12","math","easy"
6,"What color do you get by mixing red and blue?","purple","art","easy"
7,"Who painted the Mona Lisa?","Leonardo da Vinci","art","medium"
8,"What planet is known as the Red Planet?","Mars","science","easy"
